,Text,Username,Unnamed: 0,Datetime,polarity
0,"@nic__carter LMAO. I agree but probably the stupidest idea I've ever heard in crypto.

Miners would just happily continue to mine BTC and also earn some shitcoins from the hardfork to dump into BTC. 🤦‍♂️

This is just another attempt at FUDing Bitcoin energy consumption.",SatoshiLite,123036,2021-12-11 04:02:15+00:00,Negative
1,"@hampus_s @CoinChris @wtogami @plobtc @brian_trollz @gladstein @torkelrogstad @udiWertheimer @ercwl @EdanYago @giacomozucco GitHub commits isn't everything. Shaolinfry has about 30 commits to the bitcoin repo, which are mostly test changes, removing code, documentation, and formatting. They were mostly done in a 1 year or so timeframe. But that doesn’t mean he didn’t contribute signficantly to Bitcoin",SatoshiLite,123038,2021-11-22 18:16:56+00:00,Positive
2,"@hampus_s @wtogami @plobtc @brian_trollz @gladstein @torkelrogstad @udiWertheimer @ercwl @EdanYago @giacomozucco He did a lot of merging/rebasing, ideas, revamping process, handling community, strategizing activation, fighting Jihan, segwit bounty, and many more things not captured by GitHub.

For example, here’s my contribution to Litecoin:
https://t.co/LuhtD7AkNJ https://t.co/P7F62cQYa2",SatoshiLite,123039,2021-11-22 17:44:12+00:00,Positive
3,"@brian_trollz @ercwl @lite_hause @HassanAesthetic @wtogami @plobtc @gladstein @torkelrogstad @udiWertheimer @EdanYago @giacomozucco Shaolinfry supported Litecoin with ideas and code, which is much more than most litecoiner have done for Litecoin. Most litecoiners ulterior motive is more USD. Does that make them not a litecoiner?",SatoshiLite,123040,2021-11-22 17:10:48+00:00,Positive
4,"@brian_trollz @ercwl @lite_hause @HassanAesthetic @wtogami @plobtc @gladstein @torkelrogstad @udiWertheimer @EdanYago @giacomozucco They matter to the same degree that manslaughter is different than murder. You don’t work on Litecoin for a year and not be labeled a litecoiner just because you have ulterior motives. He’s maybe not a litecoiner now. Doesn’t matter. At the time, he was a supporter of Litecoin.",SatoshiLite,123041,2021-11-22 17:09:19+00:00,Positive
5,@brian_trollz @ercwl @lite_hause @HassanAesthetic @wtogami @plobtc @gladstein @torkelrogstad @udiWertheimer @EdanYago @giacomozucco No one’s trying to convict shaolinfry of shitcoining. So manslaughter instead of murder. Shaolinfry gets 1 year of toxic Bitcoin maximalist shaming instead of for life. Happy now?,SatoshiLite,123042,2021-11-22 17:02:59+00:00,Positive
6,@brian_trollz @ercwl @lite_hause @HassanAesthetic @wtogami @plobtc @gladstein @torkelrogstad @udiWertheimer @EdanYago @giacomozucco https://t.co/zxHd0Wckjz,SatoshiLite,123043,2021-11-22 16:59:26+00:00,Positive
7,"@brian_trollz @ercwl @lite_hause @HassanAesthetic @wtogami @plobtc @gladstein @torkelrogstad @udiWertheimer @EdanYago @giacomozucco To me, he was a Litecoin developer. I worked with him for over a year and treated him as a fellow Litecoin developer and friend. I am not misrepresenting any facts.

I’m not trying to change your mind. You can think however you want, but I stated what I believe to be true.",SatoshiLite,123044,2021-11-22 16:56:00+00:00,Negative
8,"@brian_trollz @ercwl @lite_hause @HassanAesthetic @wtogami @plobtc @gladstein @torkelrogstad @udiWertheimer @EdanYago @giacomozucco That doesn’t make him not a Litecoin developer or not an altcoiner. “Sorry judge, I just put on a facade of a killer.""",SatoshiLite,123045,2021-11-22 16:51:08+00:00,Positive
9,"@brian_trollz @lite_hause @HassanAesthetic @wtogami @plobtc @gladstein @torkelrogstad @udiWertheimer @ercwl @EdanYago @giacomozucco You do not know what I know or don’t know. Not only do you claim to know shaolinfry’s true motive, you also claim to know what I know or not know. You win.

https://t.co/lYMJ75G3Wn",SatoshiLite,123046,2021-11-22 16:50:17+00:00,Positive
10,@brian_trollz @lite_hause @HassanAesthetic @wtogami @plobtc @gladstein @torkelrogstad @udiWertheimer @ercwl @EdanYago @giacomozucco Actions speak louder than words. And the idea (UASF) is much more important than the man. I can care less if he's a shitcoiner or a bad person. Don't really know why it matters so much to you that he's an altcoiner or now.,SatoshiLite,123047,2021-11-22 16:41:27+00:00,Positive
11,"@brian_trollz @lite_hause @HassanAesthetic @wtogami @plobtc @gladstein @torkelrogstad @udiWertheimer @ercwl @EdanYago @giacomozucco When Warren introduced him to me many years ago, I was told that he supported Litecoin but didn't want other Bitcoin devs to know, hence the pseudonym. He never contradicted that stance to me privately. He either pretended to me or lied to you to save face. Doesn't matter TBH.",SatoshiLite,123048,2021-11-22 16:16:37+00:00,Positive
12,"@brian_trollz @lite_hause @HassanAesthetic @wtogami @plobtc @gladstein @torkelrogstad @udiWertheimer @ercwl @EdanYago @giacomozucco ""Important second currency"" - shaolinfry, Litecoin developer https://t.co/rytxIK33wx",SatoshiLite,123049,2021-11-22 16:13:15+00:00,Positive
13,"@brian_trollz @wtogami @plobtc @gladstein @torkelrogstad @udiWertheimer @ercwl @EdanYago @giacomozucco ""Important second currency"" - shaolinfry, Litecoin developer https://t.co/2uGpH4xJG5",SatoshiLite,123050,2021-11-22 16:12:33+00:00,Positive
14,"@brian_trollz @lite_hause @HassanAesthetic @wtogami @plobtc @gladstein @torkelrogstad @udiWertheimer @ercwl @EdanYago @giacomozucco Fine, you call Shaolinfry a Bitcoiner but most other people know him as a Litecoiner. I think he's both and that my opinion. He can come out tomorrow to claim he's a toxic Bitcoiner and hates Litecoin. Doesn't change the fact that he helped Litecoin and supported Litecoin in 2016",SatoshiLite,123051,2021-11-22 08:26:58+00:00,Positive
15,"@brian_trollz @lite_hause @HassanAesthetic @wtogami @plobtc @gladstein @torkelrogstad @udiWertheimer @ercwl @EdanYago @giacomozucco I’m pretty sure you’ve done it before. If you have not, I apologize. But the 2nd point stands. No one should call anyone else a shitcoiner by your reasoning.",SatoshiLite,123052,2021-11-22 08:11:20+00:00,Positive
16,"@wtogami @brian_trollz @lite_hause @HassanAesthetic @plobtc @gladstein @torkelrogstad @udiWertheimer @ercwl @EdanYago @giacomozucco Indeed, you did their job for them. Probably better than most cable technicians.",SatoshiLite,123053,2021-11-22 08:10:18+00:00,Positive
17,"@brian_trollz @lite_hause @HassanAesthetic @wtogami @plobtc @gladstein @torkelrogstad @udiWertheimer @ercwl @EdanYago @giacomozucco Then don’t label me a shitcoiner because you don’t know my motives since I haven’t told you. For that matter, don’t call anyone else a shitcoiner because you don’t know their motives.

I think I’m done with this conversation. Boring conversation anyway.",SatoshiLite,123054,2021-11-22 08:08:16+00:00,Negative
18,@brian_trollz @lite_hause @HassanAesthetic @wtogami @plobtc @gladstein @torkelrogstad @udiWertheimer @ercwl @EdanYago @giacomozucco https://t.co/IjA4yInl6w,SatoshiLite,123055,2021-11-22 08:01:46+00:00,Positive
19,@brian_trollz @lite_hause @HassanAesthetic @wtogami @plobtc @gladstein @torkelrogstad @udiWertheimer @ercwl @EdanYago @giacomozucco The definition of being an open source developer of a project is pretty simple and straightforward. You don’t have to find out someone’s motivations in order to know whether or not they are a developer. I’m not the fool here.,SatoshiLite,123056,2021-11-22 07:59:23+00:00,Positive
20,@brian_trollz @lite_hause @HassanAesthetic @wtogami @plobtc @gladstein @torkelrogstad @udiWertheimer @ercwl @EdanYago @giacomozucco So one can argue he's a bitcoin cash developer. I probably would agree if he spent hours looking through BCH code and helped them fix issues. I don’t know how much he worked on it.,SatoshiLite,123057,2021-11-22 07:55:12+00:00,Positive
21,"@brian_trollz @lite_hause @HassanAesthetic @wtogami @plobtc @gladstein @torkelrogstad @udiWertheimer @ercwl @EdanYago @giacomozucco Now you are being disingenuous. Greg wrote like a few lines for BCH. Shaolinfry work on Litecoin for a year. If Greg worked on BCH for a year, I would call him a bcasher.",SatoshiLite,123058,2021-11-22 07:50:40+00:00,Negative
22,"@brian_trollz @lite_hause @HassanAesthetic @wtogami @plobtc @gladstein @torkelrogstad @udiWertheimer @ercwl @EdanYago @giacomozucco If he didn’t want UASF to be associated with Litecoin, he could have launched it with his other Bitcoin dev pseudonym and no one would associated UASF with Litecoin today. He didn’t do that.",SatoshiLite,123059,2021-11-22 07:49:32+00:00,Positive
23,"@brian_trollz @lite_hause @HassanAesthetic @wtogami @plobtc @gladstein @torkelrogstad @udiWertheimer @ercwl @EdanYago @giacomozucco Well, shaolinfry doesn’t get to have the cake and eat it to. He worked on Litecoin, so he’s an altcoiner. You don’t get to use Litecoin and drop it when it’s not convenient. Maybe he wasn’t an altcoiner before 2016 and not one after 2017. But when he launched UASF, he was.",SatoshiLite,123060,2021-11-22 07:47:43+00:00,Positive
24,"@brian_trollz @lite_hause @HassanAesthetic @wtogami @plobtc @gladstein @torkelrogstad @udiWertheimer @ercwl @EdanYago @giacomozucco To be honest, I don’t know how much he supported Litecoin. I don’t know how much any of the Litecoin devs supported Litecoin. There’s no bar you have to reach in order to be a litecoin developer. All that matters is that supported Litecoin via code development.",SatoshiLite,123061,2021-11-22 07:39:17+00:00,Positive
25,"@brian_trollz @lite_hause @HassanAesthetic @wtogami @plobtc @gladstein @torkelrogstad @udiWertheimer @ercwl @EdanYago @giacomozucco People tend to exagerate in arguments. By no, I mean few. Just like how you guys are saying every UASFers were toxic to Litecoin.",SatoshiLite,123062,2021-11-22 07:34:48+00:00,Negative
26,"@brian_trollz @lite_hause @HassanAesthetic @wtogami @plobtc @gladstein @torkelrogstad @udiWertheimer @ercwl @EdanYago @giacomozucco YOU can play semantics and say that because of his motivation that he told you privately, it doesn’t make him an altcoiner.

People, who where there in 2017, saw that a Litecoin developer helped push UASF on Bitcoin. Neither he nor any other Bitcoiner were toxic to Litecoin then.",SatoshiLite,123063,2021-11-22 07:29:05+00:00,Negative
27,"@brian_trollz @lite_hause @HassanAesthetic @wtogami @plobtc @gladstein @torkelrogstad @udiWertheimer @ercwl @EdanYago @giacomozucco Was his motive to prevent Litecoin from embarassing Bitcoin or was it to make Jihan look like a fool? Or both? It doesn’t matter in my book or 99% of people.

Shaolinfry helped Litecoin tremendously and was vital in helping us get SegWit activated on Litecoin.",SatoshiLite,123064,2021-11-22 07:26:11+00:00,Positive
28,"@brian_trollz @lite_hause @HassanAesthetic @wtogami @plobtc @gladstein @torkelrogstad @udiWertheimer @ercwl @EdanYago @giacomozucco Warren was a Litecoin lead developer also. Did he have ulterior motives? Sure, he used Litecoin to springboard himself to bigger and better things. Do I fault him for that? No! But you can’t rewrite history and say Warren was not the lead Litecoin developer at one time.",SatoshiLite,123065,2021-11-22 07:19:57+00:00,Negative
29,"@brian_trollz @lite_hause @HassanAesthetic @wtogami @plobtc @gladstein @torkelrogstad @udiWertheimer @ercwl @EdanYago @giacomozucco I worked with shaolinfry for a year on Litecoin Core. It’s not feelings. He developed on Litecoin. Period. He’s a Litecoin developer.

AND he’s a Bitcoin developer. These are not exclusive things. And having ulterior motives doesn’t make him not a Litecoin developer.",SatoshiLite,123066,2021-11-22 07:18:59+00:00,Negative
30,"@brian_trollz @lite_hause @HassanAesthetic @wtogami @plobtc @gladstein @torkelrogstad @udiWertheimer @ercwl @EdanYago @giacomozucco Action speaks louder than words. By his actions, he was a Litecoin developer. I don't see how anyone can argue about that.

Maybe in his heart, he hated Litecoin and wanted to kill it. But I definitely didn't get that from my experience working with him and talking to him,",SatoshiLite,123067,2021-11-22 07:11:22+00:00,Negative
31,"@brian_trollz @toocryptotoquit @lite_hause @HassanAesthetic @wtogami @plobtc @gladstein @torkelrogstad @udiWertheimer @ercwl @EdanYago @giacomozucco Do you even believe what you are typing? Do people really worry about that? If Litecoin crashed and burned, Bitcoin would get hurt. Really?!",SatoshiLite,123068,2021-11-22 07:07:02+00:00,Negative
32,@brian_trollz @lite_hause @HassanAesthetic @wtogami @plobtc @gladstein @torkelrogstad @udiWertheimer @ercwl @EdanYago @giacomozucco You're the one gaslighting and trying to rewrite history. Saying that Shaolifry wasn't a Litecoin developer because of his motives. What kind of argument is that?,SatoshiLite,123069,2021-11-22 07:04:51+00:00,Negative
33,"@brian_trollz @lite_hause @HassanAesthetic @wtogami @plobtc @gladstein @torkelrogstad @udiWertheimer @ercwl @EdanYago @giacomozucco *Wouldn't skip a beat.

Maybe you were not aware of the full story. Either way, it doesn't change the fact that Shaolinfry was a Litecoin developer. He's done more for Litecoin than just fixing any embarrassment.",SatoshiLite,123070,2021-11-22 07:02:21+00:00,Positive
34,"@brian_trollz @lite_hause @HassanAesthetic @wtogami @plobtc @gladstein @torkelrogstad @udiWertheimer @ercwl @EdanYago @giacomozucco That's ridiculous. Why would a Litecoin bug hurt Bitcoin? Are people not worried about the same thing today? Is it somehow different in 2016? That's laughable to be honest. If Litecoin died in 2016, Bitcoin would skip a beat.",SatoshiLite,123071,2021-11-22 06:59:39+00:00,Positive
35,"@brian_trollz @lite_hause @HassanAesthetic @wtogami @plobtc @gladstein @torkelrogstad @udiWertheimer @ercwl @EdanYago @giacomozucco So Udi is not wrong to think or say that one of the biggest proponents of UASF was an altcoin developer. Because he was. Shaolinfry was a LTC developer and some people also knew that the person behind the nym was also a Bitcoin developer.

That was the original topic I addressed.",SatoshiLite,123072,2021-11-22 06:49:20+00:00,Negative
36,@brian_trollz @lite_hause @HassanAesthetic @wtogami @plobtc @gladstein @torkelrogstad @udiWertheimer @ercwl @EdanYago @giacomozucco Only a few people knew him to be a Bitcoin dev. Everyone else only knew him to be a Litecoin dev. So why did he choose to push UASF as a Litecoin dev instead of a Bitcoin dev? I don't really know. I'm guessing because we pushed the idea of UASF on Litecoin first.,SatoshiLite,123073,2021-11-22 06:47:09+00:00,Negative
37,"@brian_trollz @lite_hause @HassanAesthetic @wtogami @plobtc @gladstein @torkelrogstad @udiWertheimer @ercwl @EdanYago @giacomozucco Actually, what's your definition of an altcoiner? And does that definition not fit Shaolinfry, who spent 1 year on Litecoin development?

Maybe we just have a different definition of altcoiner.",SatoshiLite,123074,2021-11-22 06:41:33+00:00,Positive
38,"@brian_trollz @lite_hause @HassanAesthetic @wtogami @plobtc @gladstein @torkelrogstad @udiWertheimer @ercwl @EdanYago @giacomozucco I've said that Shaolinfry is a nym for a Bitcoiner. So if you want to say UASF was founded by a Bitcoiner, then yes, it was. Altcoiner, Bitcoiner. So what! Why is the guy more important than the idea?!

The original point was that all UASFers were anti-altcoin. That's false.",SatoshiLite,123075,2021-11-22 06:38:16+00:00,Negative
39,@TaeRoyle @udiWertheimer @gladstein @brian_trollz @wtogami @plobtc @torkelrogstad @ercwl @EdanYago @giacomozucco Just Google it. https://t.co/fvyXQaBXqW,SatoshiLite,123076,2021-11-22 06:01:27+00:00,Positive
40,"@lite_hause @HassanAesthetic @brian_trollz @wtogami @plobtc @gladstein @torkelrogstad @udiWertheimer @ercwl @EdanYago @giacomozucco Ridiculous that anyone is trying to claim Shaolinfry was not a Litecoin developer. I worked with him closely with Thrasher and Loshan and others for a year on Litecoin Core development.

He could be Satoshi Nakamoto for all I care. He still was a Litecoin developer.",SatoshiLite,123077,2021-11-22 05:56:39+00:00,Positive
41,@udiWertheimer @gladstein @brian_trollz @wtogami @plobtc @torkelrogstad @ercwl @EdanYago @giacomozucco UASF movement was toxic in a sense that it was very aggressive and calling anyone out that supported the NYA and Segwit2x. It toxicity wasn't targeted towards altcoiners except for those that supported NYA and Segwit2x.,SatoshiLite,123078,2021-11-22 05:54:01+00:00,Positive
42,"@brian_trollz @wtogami @plobtc @gladstein @torkelrogstad @udiWertheimer @ercwl @EdanYago @giacomozucco Still don't know where I lied or misrepresented facts.

The person behind both the Bitcoiner nym and Shaolinfry, worked on Litecoin as a developer. He doesn't hate Litecoin AFAIK or else he wouldn't have worked on it. He hasn't spoken ill of Litecoin that I'm aware of.",SatoshiLite,123079,2021-11-22 05:49:51+00:00,Negative
43,"@wtogami @brian_trollz @plobtc @gladstein @torkelrogstad @udiWertheimer @ercwl @EdanYago @giacomozucco It was either Shaolinfry or Thrasher that ported SegWit. Maybe Thrasher did the initial port and Shaolinfry fix it up. I don't remember, but does it matter?

We released it around December 2016 IIRC.

I'm not sure what unfortunate motive you're referring to.",SatoshiLite,123080,2021-11-22 05:45:53+00:00,Positive
44,@brian_trollz @wtogami @plobtc @gladstein @torkelrogstad @udiWertheimer @ercwl @EdanYago @giacomozucco I've never said anything about Shaolinfry's motives. So how am I misrepresenting his motives?!,SatoshiLite,123081,2021-11-22 04:23:11+00:00,Negative
45,"@brian_trollz @wtogami @plobtc @gladstein @torkelrogstad @udiWertheimer @ercwl @EdanYago @giacomozucco Nym was a Litecoin developer. He was using Litecoin for his own motives that I wasn't fully aware until afterwards. But we do things with our own motivations that may not be public.

That doesn't change the fact that Shaolinfry was a Litecoin developer.",SatoshiLite,123082,2021-11-22 04:21:15+00:00,Negative
46,"@brian_trollz @wtogami @plobtc @gladstein @torkelrogstad @udiWertheimer @ercwl @EdanYago @giacomozucco His Bitcoin dev identity is a nym AFAIK.

He worked on Litecoin for a year. He helped with SegWit and other things. His true motives were not clear to me until much later.",SatoshiLite,123083,2021-11-22 04:15:33+00:00,Negative
47,"@HassanAesthetic @brian_trollz @wtogami @plobtc @gladstein @torkelrogstad @udiWertheimer @ercwl @EdanYago @giacomozucco July 3rd, 2016 to July 25th, 2017

More than a year. https://t.co/zM2jPac2ih",SatoshiLite,123084,2021-11-22 04:13:42+00:00,Positive
48,@brian_trollz @wtogami @plobtc @gladstein @torkelrogstad @udiWertheimer @ercwl @EdanYago @giacomozucco Be specific where I’m being disingenuous.,SatoshiLite,123085,2021-11-22 04:11:03+00:00,Negative
49,@brian_trollz @zndtoshi @wtogami @plobtc @gladstein @torkelrogstad @udiWertheimer @ercwl @EdanYago @giacomozucco Point out the lie please. I'm happy to correct anything.,SatoshiLite,123086,2021-11-22 04:10:39+00:00,Positive
50,@brian_trollz @wtogami @plobtc @gladstein @torkelrogstad @udiWertheimer @ercwl @EdanYago @giacomozucco His contributions to Litecoin was huge. Don't belittle it. It doesn't matter if his contributions to Bitcoin was more. But the pseudonym is only publicly known as a Litecoin developer and that's what we are talking about here. Are we not?,SatoshiLite,123087,2021-11-22 04:08:52+00:00,Positive
51,"@wtogami @brian_trollz @plobtc @gladstein @torkelrogstad @udiWertheimer @ercwl @EdanYago @giacomozucco All facts, but I wasn't going to say any of this because Shaolifry wanted this a secret. But that doesn't change the fact about anything I said.",SatoshiLite,123088,2021-11-22 04:06:28+00:00,Negative
52,"@brian_trollz @wtogami @plobtc @gladstein @torkelrogstad @udiWertheimer @ercwl @EdanYago @giacomozucco He worked on Litecoin with me and Thrasher and Loshan for months! You think you know this better than I? When he came out with the UASF code, everyone only knew him as a Litecoin developer. How is this wrong?!",SatoshiLite,123089,2021-11-22 04:04:49+00:00,Positive
53,"@wtogami @plobtc @brian_trollz @gladstein @torkelrogstad @udiWertheimer @ercwl @EdanYago @giacomozucco I don't see how I'm misstating history. If he wanted Shaolinfry to be known as a Bitcoin dev first, he should have kept his Bitcoin nym. You don't get to have the cake and eat it too. He wanted a new nym so that his Bitcoin nym is not seen supporting an altcoin.",SatoshiLite,123090,2021-11-22 04:02:51+00:00,Negative
54,"@brian_trollz @wtogami @plobtc @gladstein @torkelrogstad @udiWertheimer @ercwl @EdanYago @giacomozucco Yes, and Warren had said as much. Does that change the fact that he worked on Litecoin as Shaolinfry and was a Litecoin Core developer also?

Everyone else knew Shaolinfry as a Litecoin developer. Is that wrong?",SatoshiLite,123091,2021-11-22 03:59:53+00:00,Positive
55,"@brian_trollz @wtogami @plobtc @gladstein @torkelrogstad @udiWertheimer @ercwl @EdanYago @giacomozucco Of course I know who he is! He wasn't a toxic Bitcoiner. If he was, he wouldn't be working on Litecoin.",SatoshiLite,123092,2021-11-22 03:57:46+00:00,Negative
56,@brian_trollz @wtogami @plobtc @gladstein @torkelrogstad @udiWertheimer @ercwl @EdanYago @giacomozucco I have no idea what you are talking about. Which statement was a lie?,SatoshiLite,123093,2021-11-22 03:55:48+00:00,Positive
57,@wtogami @plobtc @brian_trollz @gladstein @torkelrogstad @udiWertheimer @ercwl @EdanYago @giacomozucco That doesn't change the fact that Litecoin was useful. To say every UASF supporter was a toxic Bitcoiner is false. I was out there pushing for UASF on Bitcoin also.,SatoshiLite,123094,2021-11-22 03:55:01+00:00,Negative
58,@brian_trollz @wtogami @plobtc @gladstein @torkelrogstad @udiWertheimer @ercwl @EdanYago @giacomozucco Knew better about what? I'm just stating facts.,SatoshiLite,123095,2021-11-22 03:53:37+00:00,Positive
59,"@wtogami @plobtc @brian_trollz @gladstein @torkelrogstad @udiWertheimer @ercwl @EdanYago @giacomozucco So Shaolinfry was a well-known altcoiner when he was pushing for UASF. No one knew him as a Bitcoiner. Apparently, it was beneficial for him to use his Litecoin dev nym to push for UASF. I didn't appreciate how he used Litecoin when it suited him but dropped it when it didnt.",SatoshiLite,123096,2021-11-22 03:52:44+00:00,Negative
60,@wtogami @plobtc @brian_trollz @gladstein @torkelrogstad @udiWertheimer @ercwl @EdanYago @giacomozucco Shaolinfry pseudonym was a Litecoin Core developer first and UASF supporter second. It doesn't really matter if he was previously a Bitcoin developer. Shaolinfry was a Litecoin developer when he helped me with UASF on Litecoin and afterwards when he pushed for UASF on Bitcoin.,SatoshiLite,123097,2021-11-22 03:49:28+00:00,Positive
61,"Congratulations Bitcoin!

Thanks for being Litecoin's testnet. If no issues are found with Taproot on Bitcoin, we will launch it on Litecoin! 😂 https://t.co/7iltrGwdJw",SatoshiLite,123098,2021-11-14 22:07:20+00:00,Positive
62,"Coinbase did not put any resources behind this launch and pretty much just quietly launched the LTC/BTC and LTC/USD trading pairs with an empty order book. For reasons unknown to me, Brian &amp; Fred refused to do a full launch on GDAX &amp; Coinbase like we did with ETH.",SatoshiLite,123140,2021-10-12 17:04:10+00:00,Negative
63,"Oh, forgot to mention, there was also the first cross-chain atomic swap between Litecoin and Bitcoin with John Stefanopoulos (@JStefanop1).

John is the creator of the awesome FutureBit LTC miners. He's helping with the decentralization of mining!

https://t.co/AhV06wZLNe",SatoshiLite,123142,2021-10-08 19:58:14+00:00,Positive
64,"And on November 16, the first ever cross-chain swap between BTC and LTC via Lightning happened! This fulfilled my vision of LTC and BTC moving seamlessly on the Lightning Network.

That's it for the history of SegWit and LN on Litecoin. More later...

https://t.co/rOTC1ukprl",SatoshiLite,123143,2021-10-08 19:29:55+00:00,Negative
65,"On August 24, SegWit activates on Bitcoin with the help of UASF!

It's hard to know exactly how much Litecoin helped with this. I feel like it definitely has helped. My guess is it still would have happened eventually but might have taken much longer.

https://t.co/t6Hr8VS1OB",SatoshiLite,123146,2021-10-08 19:23:46+00:00,Negative
66,"It felt like the whole crypto space was waiting for this. Christian Decker (@Snyke) made the first LN payment on Litecoin. Shows that even Bitcoin developers were excited about LN on Litecoin and immediately tested it out right after SegWit activated. 
https://t.co/gwX0R2FxtV",SatoshiLite,123148,2021-10-08 19:20:11+00:00,Negative
67,"All this was just wrong. Users wanted SegWit. Markets wanted it. Why are miners, basically 1 person, able to block something that is good for Litecoin and Bitcoin.

In the end, miners are being paid to do one thing, which is to collect transactions into blocks and broadcast them.",SatoshiLite,123156,2021-10-08 19:05:15+00:00,Positive
68,"The difference between Bitcoin and Litecoin is me. Bitcoin is more decentralized. There's no one to come out to speak on what their vision of Bitcoin is. But for Litecoin, I can come out and tell the world my vision for Litecoin, which I have done.",SatoshiLite,123169,2021-10-08 18:37:07+00:00,Positive
69,"Unfortunately that became very contentious. Because Jihan had a lot of influence, he single-handedly was able to block SegWit activation on Bitcoin. And because Bitmain also made one of the most efficient Litecoin miners, he had a lot of influence on Litecoin miners also.",SatoshiLite,123170,2021-10-08 18:35:27+00:00,Positive
